{
  "project": "Hello Wave",
  "dirs": {
    "planning": "planning",
    "adr": "docs/adr",
    "plan": "docs/plan.md",
    "checkpoints": ".whw/checkpoints",
    "state": ".whw/state.db"
  },
  "gates": {
    "tiers": {
      "pr": ["planning-coverage", "adr-link", "wave-sync", "readme-sync", "agents-parity", "no-secrets"],
      "ops": ["program-inventory", "evidence-quality"]
    },
    "custom": []
  },
  "evaluate": {
    "phaseA": ["node --test \"tests/**/*.test.js\""],
    "threshold": 3.5,
    "criteria": [
      { "id": "technical-quality", "weight": 1.3 },
      { "id": "originality", "weight": 1.3 },
      { "id": "craft", "weight": 1.0 },
      { "id": "functionality", "weight": 1.0 }
    ]
  }
}
