{
  "$schema": "./docs/what/config.schema.json",
  "project": "WHW",
  "dirs": {
    "planning": "planning",
    "adr": "docs/adr",
    "plan": "docs/plan.md",
    "checkpoints": ".whw/checkpoints",
    "state": ".whw/state.db"
  },
  "gates": {
    "tiers": {
      "pr": ["planning-coverage", "adr-link", "wave-sync", "readme-sync", "agents-parity", "no-secrets"],
      "ops": ["program-inventory"]
    },
    "custom": []
  },
  "evaluate": {
    "phaseA": ["node --test \"tests/**/*.test.js\""],
    "threshold": 3.5,
    "criteria": [
      { "id": "technical-quality", "weight": 1.3 },
      { "id": "originality", "weight": 1.3 },
      { "id": "craft", "weight": 1.0 },
      { "id": "functionality", "weight": 1.0 }
    ]
  },
  "conventions": {
    "branch": "{type}/wave-{nnn}-{slug}-{letter}",
    "commit": "{type}({scope}): {summary} (Wave {nnn} {letter})",
    "waveLetters": ["A", "B", "C", "D", "E"]
  },
  "runners": {
    "default": null
  }
}
